{
  "measurement_schema_version": "1.2",
  "date": "2026-08-06",
  "surface": "runtime Codex session (codex exec)",
  "model": "gpt-5.6-luna",
  "reasoning_effort": "high",
  "skill": "savant-research-verify (namespace savant-openai:savant-research-verify)",
  "skill_loading": "symlinked to ~/.codex/skills; verified present in session skill catalog",
  "workspace": "savant-openai repo root",
  "workspace_commit": "d8f8d7a",
  "sandbox": "read-only",
  "session_mode": "ephemeral (no session persisted)",
  "lesson": {
    "id": "lesson-proof-001",
    "size_bytes": 652,
    "heuristic_added_tokens": 163,
    "token_estimator": "ceil(UTF-8 bytes / 4); heuristic, not model-token accounting"
  },
  "environment_overhead_note": "Input token counts are dominated by the installed session skill/plugin catalog. Run-to-run input deltas are non-monotonic and reflect cache variance, so per-run input deltas are not attributable to the lesson; the deterministic byte-heuristic above is the reliable lesson-overhead figure.",
  "runs": [
    {
      "fixture": "correct-proof-step",
      "fixture_path": "tests/fixtures/correct-proof-step.json",
      "expected_verdict": "VERIFIED",
      "condition": "baseline",
      "verdict": "VERIFIED",
      "match": true,
      "input_tokens": 283673,
      "cached_input_tokens": 252416,
      "output_tokens": 3723,
      "reasoning_output_tokens": 2027,
      "evidence_path": "symbolic-cas"
    },
    {
      "fixture": "correct-proof-step",
      "fixture_path": "tests/fixtures/correct-proof-step.json",
      "expected_verdict": "VERIFIED",
      "condition": "lesson-assisted",
      "verdict": "VERIFIED",
      "match": true,
      "input_tokens": 287697,
      "cached_input_tokens": 250624,
      "output_tokens": 6186,
      "reasoning_output_tokens": 3641,
      "evidence_path": "numerical-examples"
    },
    {
      "fixture": "planted-proof-error",
      "fixture_path": "tests/fixtures/planted-proof-error.json",
      "expected_verdict": "FAILED",
      "condition": "baseline",
      "verdict": "FAILED",
      "match": true,
      "input_tokens": 159381,
      "cached_input_tokens": 150016,
      "output_tokens": 3042,
      "reasoning_output_tokens": 1851,
      "evidence_path": "numerical-examples"
    },
    {
      "fixture": "planted-proof-error",
      "fixture_path": "tests/fixtures/planted-proof-error.json",
      "expected_verdict": "FAILED",
      "condition": "lesson-assisted",
      "verdict": "FAILED",
      "match": true,
      "input_tokens": 356309,
      "cached_input_tokens": 312832,
      "output_tokens": 6297,
      "reasoning_output_tokens": 3594,
      "evidence_path": "numerical-examples"
    },
    {
      "fixture": "backend-unavailable",
      "fixture_path": "tests/fixtures/backend-unavailable.json",
      "expected_verdict": "UNVERIFIED",
      "condition": "baseline",
      "verdict": "UNVERIFIED",
      "match": true,
      "input_tokens": 269299,
      "cached_input_tokens": 227328,
      "output_tokens": 4316,
      "reasoning_output_tokens": 1708,
      "evidence_path": "model-reasoning"
    },
    {
      "fixture": "backend-unavailable",
      "fixture_path": "tests/fixtures/backend-unavailable.json",
      "expected_verdict": "UNVERIFIED",
      "condition": "lesson-assisted",
      "verdict": "UNVERIFIED",
      "match": true,
      "input_tokens": 175119,
      "cached_input_tokens": 145920,
      "output_tokens": 4181,
      "reasoning_output_tokens": 2096,
      "evidence_path": "model-reasoning"
    }
  ],
  "verdict_preserved": true,
  "verdicts_match_expected": 6,
  "runs_total": 6,
  "false_verified_created": false,
  "lesson_scoping": "The approved lesson concerns denominator cancellation; none of the three fixtures involve cancellation. The model explicitly noted the lesson was out of scope and ignored it where applicable.",
  "evidence_flags": [
    {
      "fixture": "correct-proof-step",
      "condition": "lesson-assisted",
      "evidence_path": "numerical-examples"
    }
  ],
  "evidence_sources": [
    "docs/measurements/MEASUREMENT-runtime-codex-2026-08-06.md",
    "docs/measurements/logs/runtime-codex-2026-08-06/",
    "skills/savant-research-verify/SKILL.md",
    "openai/portable/contracts/verification-status.md",
    "openai/portable/learning/approved/lesson-proof-001.json",
    "tests/fixtures/correct-proof-step.json",
    "tests/fixtures/planted-proof-error.json",
    "tests/fixtures/backend-unavailable.json"
  ],
  "limitations": [
    "Single Codex session model and reasoning effort; not a model-accuracy benchmark.",
    "Token usage reflects the installed session environment; input caching varied across runs, so per-run deltas are not attributable to the lesson.",
    "The positive fixture was verified via SymPy simplification in the baseline run (evidence_path `symbolic-cas`); in the lesson-assisted run the VERIFIED verdict was justified by structural reasoning plus numerical smoke checks (evidence_path `numerical-examples`), a weaker path. Schema 1.2 flags this run in evidence_flags; no CAS script is committed in this repository yet.",
    "Raw session transcripts are not committed; reproduction requires re-running codex exec, and model behavior is non-deterministic.",
    "One fixture per class; broader multi-lesson evaluation remains separate."
  ]
}
